created_utc,score,domain,id,title,author,ups,downs,num_comments,permalink,over_18,thumbnail,subreddit_id,edited,is_self,name
1370579126,84,i.imgur.com,1fuchp,Rabindranath Tagore &amp; Albert Einstein (Aug  1941) (x-post /r/OldIndia),arijitdas,101,17,18,http://www.reddit.com/r/india/comments/1fuchp/rabindranath_tagore_albert_einstein_aug_1941/,FALSE,http://f.thumbs.redditmedia.com/2YlxCX61O4eDSSyq.jpg,t5_2qh1q,FALSE,FALSE,t3_1fuchp
1369583469,83,timesofindia.indiatimes.com,1f32ix,China has built 5km road inside Indian territory.,hiby007,98,15,33,http://www.reddit.com/r/india/comments/1f32ix/china_has_built_5km_road_inside_indian_territory/,FALSE,http://a.thumbs.redditmedia.com/CwsuawTrbY40OAbN.jpg,t5_2qh1q,FALSE,FALSE,t3_1f32ix
1368722154,82,zeenews.india.com,1egj4y,Celebrated Delhi police inspector Badrish Dutt  who was found dead with his female friend in a Gurgaon flat  was part of the team that was investigating betting in the ongoing Indian Premier League,thuglaq,99,17,11,http://www.reddit.com/r/india/comments/1egj4y/celebrated_delhi_police_inspector_badrish_dutt/,FALSE,http://b.thumbs.redditmedia.com/X_Py9hBIcBhnBuXy.jpg,t5_2qh1q,FALSE,FALSE,t3_1egj4y
1366713096,84,self.india,1cxeua,UPA govt was almost ready to give away Siachen to Pakistan. Disaster averted only after Indian army firmly opposed the stupidity. [WikiLeaks],dark-ritual,108,24,41,http://www.reddit.com/r/india/comments/1cxeua/upa_govt_was_almost_ready_to_give_away_siachen_to/,FALSE,self,t5_2qh1q,FALSE,TRUE,t3_1cxeua
1365572844,89,i.imgur.com,1c1p48,I am a Maharashtrian Dawg :),Envia,151,62,66,http://www.reddit.com/r/india/comments/1c1p48/i_am_a_maharashtrian_dawg/,FALSE,http://d.thumbs.redditmedia.com/bmoPHMpe4KOc-mg3.jpg,t5_2qh1q,FALSE,FALSE,t3_1c1p48
1363145558,82,self.india,1a706q,The decline and fall of Indian Civilization,karma_hunter,119,37,225,http://www.reddit.com/r/india/comments/1a706q/the_decline_and_fall_of_indian_civilization/,FALSE,self,t5_2qh1q,1363153966,TRUE,t3_1a706q
1361516281,85,nextbigwhat.com,190cmk,184 year old Indian library goes digital  rare books including 444 year old book on Alexander the Great online,ashwinm,97,12,3,http://www.reddit.com/r/india/comments/190cmk/184_year_old_indian_library_goes_digital_rare/,FALSE,http://c.thumbs.redditmedia.com/l2hOrmNx0KThH2rP.jpg,t5_2qh1q,FALSE,FALSE,t3_190cmk
1360050527,84,self.india,17x8uw,A list of India Related Sub Reddits,neoronin,99,15,45,http://www.reddit.com/r/india/comments/17x8uw/a_list_of_india_related_sub_reddits/,FALSE,self,t5_2qh1q,1360062816,TRUE,t3_17x8uw
1354902298,86,edition.cnn.com,14gbw0,"A man in India is living in exile after being charged with blasphemy for debunking a ""weeping Jesus"".",kakashi_,102,16,15,http://www.reddit.com/r/india/comments/14gbw0/a_man_in_india_is_living_in_exile_after_being/,FALSE,http://b.thumbs.redditmedia.com/-IpDQ-JA-gI2LdEa.jpg,t5_2qh1q,FALSE,FALSE,t3_14gbw0
1348475392,82,medianama.com,10duvn,JustDial's Android app pulled from Google Play for secretly pulling users' Phone Diaries,agentbigman,104,22,36,http://www.reddit.com/r/india/comments/10duvn/justdials_android_app_pulled_from_google_play_for/,FALSE,http://b.thumbs.redditmedia.com/9oyF1bL2jTUszoCm.jpg,t5_2qh1q,FALSE,FALSE,t3_10duvn
1344707912,87,london2012.com,y20p1,YAY YAY again! Yogeshwar dutt wins India bronze medal in Olympics Wrestling.,identity_none,100,13,22,http://www.reddit.com/r/india/comments/y20p1/yay_yay_again_yogeshwar_dutt_wins_india_bronze/,FALSE,default,t5_2qh1q,FALSE,FALSE,t3_y20p1
1342695955,84,i.imgur.com,wt8pf,Outlook's latest cover : Stooping so low to defend UPA,thuglaq,110,26,54,http://www.reddit.com/r/india/comments/wt8pf/outlooks_latest_cover_stooping_so_low_to_defend/,FALSE,http://c.thumbs.redditmedia.com/ivqsxYJGuZt3dwpn.jpg,t5_2qh1q,FALSE,FALSE,t3_wt8pf
1335937561,83,youtube.com,t2vw1,Hello r/India  I am not Indian but I recently made a really embarrassing bollywood video for an audition. Have at it!,JulianAssage,115,32,96,http://www.reddit.com/r/india/comments/t2vw1/hello_rindia_i_am_not_indian_but_i_recently_made/,FALSE,http://c.thumbs.redditmedia.com/qMWCvuNIXdyJmQ3J.jpg,t5_2qh1q,FALSE,FALSE,t3_t2vw1
1334142213,86,i.imgur.com,s45v1,SCUMBAG Telecoms,naveen_reloaded,101,15,17,http://www.reddit.com/r/india/comments/s45v1/scumbag_telecoms/,FALSE,http://e.thumbs.redditmedia.com/ChfxDq6I-Yc_Jf24.jpg,t5_2qh1q,FALSE,FALSE,t3_s45v1
1327748243,83,img17.imageshack.us,p0e1u,Beautiful pic of Rajdhani near a tunnel in pune,Manoos,97,14,12,http://www.reddit.com/r/india/comments/p0e1u/beautiful_pic_of_rajdhani_near_a_tunnel_in_pune/,FALSE,http://a.thumbs.redditmedia.com/cTYYaBwl1eOrGn6N.jpg,t5_2qh1q,FALSE,FALSE,t3_p0e1u
1320805138,84,i.imgur.com,m5ku4,It's shit like this India  that makes my blood boil,marathi_mulga,101,17,34,http://www.reddit.com/r/india/comments/m5ku4/its_shit_like_this_india_that_makes_my_blood_boil/,FALSE,http://b.thumbs.redditmedia.com/cB0NFgQmvNcMlmwU.jpg,t5_2qh1q,FALSE,FALSE,t3_m5ku4
1283841334,88,sphotos.ak.fbcdn.net,dahxj,This happens only in India!,wastedland,99,11,48,http://www.reddit.com/r/india/comments/dahxj/this_happens_only_in_india/,FALSE,http://thumbs.reddit.com/t3_dahxj.png,t5_2qh1q,FALSE,FALSE,t3_dahxj
1375946555,84,imgur.com,1jxya3,Get a cock with each Biryani..,petty86,97,13,16,http://www.reddit.com/r/india/comments/1jxya3/get_a_cock_with_each_biryani/,FALSE,http://a.thumbs.redditmedia.com/topv9NB0i_d-b-H0.jpg,t5_2qh1q,FALSE,FALSE,t3_1jxya3
1374402845,83,deccanherald.com,1iqu2p,Mars mission not for pride  we mean business  says ISRO,amazion,99,16,50,http://www.reddit.com/r/india/comments/1iqu2p/mars_mission_not_for_pride_we_mean_business_says/,FALSE,http://b.thumbs.redditmedia.com/MhR0aWNxUnGzeFVO.jpg,t5_2qh1q,FALSE,FALSE,t3_1iqu2p
1374147053,83,imgur.com,1ijwkw,A graffiti on Marine Drive  Mumbai,zzyxvsn,110,27,71,http://www.reddit.com/r/india/comments/1ijwkw/a_graffiti_on_marine_drive_mumbai/,FALSE,http://d.thumbs.redditmedia.com/5lEp9fSCQWend_IQ.jpg,t5_2qh1q,FALSE,FALSE,t3_1ijwkw
1371541876,86,self.india,1gkn4n,This is what salmans six packs really looks like  and this is what our public see.,hiby007,106,20,79,http://www.reddit.com/r/india/comments/1gkn4n/this_is_what_salmans_six_packs_really_looks_like/,FALSE,self,t5_2qh1q,FALSE,TRUE,t3_1gkn4n
1368148440,85,greatandhra.com,1e1grf,"""Why would I apologise to Charan? For getting beaten up?"" - Remember the recent Ram Charan incident? Here is the victim's side of the story.",lovelldies,93,8,62,http://www.reddit.com/r/india/comments/1e1grf/why_would_i_apologise_to_charan_for_getting/,FALSE,http://e.thumbs.redditmedia.com/w-s6GF_-u5yilyTj.jpg,t5_2qh1q,FALSE,FALSE,t3_1e1grf
1368116240,87,mid-day.com,1e0b6y,Good news from hockey: Indian men beat Netherlands 4-2. This is second consecutive win over Dutch in the same series.,Chacha-Choudhry,104,17,6,http://www.reddit.com/r/india/comments/1e0b6y/good_news_from_hockey_indian_men_beat_netherlands/,FALSE,http://b.thumbs.redditmedia.com/_SjNURcsL0_NsDhm.jpg,t5_2qh1q,FALSE,FALSE,t3_1e0b6y
1366684827,83,self.india,1cwruu,CBSE CHANGED SYLLABUS OF COMPUTER SCIENCE SUBJECT FROM THIS SESSION FROM C++ TO PYTHON,little1991,103,20,67,http://www.reddit.com/r/india/comments/1cwruu/cbse_changed_syllabus_of_computer_science_subject/,FALSE,self,t5_2qh1q,FALSE,TRUE,t3_1cwruu
1366605147,82,hindustantimes.com,1cug0l,Preity Zinta chases ambulance in a hit and run case and tells cops about accident  but no action taken,Manoos,93,11,22,http://www.reddit.com/r/india/comments/1cug0l/preity_zinta_chases_ambulance_in_a_hit_and_run/,FALSE,http://e.thumbs.redditmedia.com/pyS4QuOzKV5zCh7R.jpg,t5_2qh1q,FALSE,FALSE,t3_1cug0l
1366209255,84,ndtv.com,1cj89q,"Jayalithaa's one-rupee idlis are a hit: ""The Tamil Nadu Chief Minister launched the kitchens  run entirely by women's self-help groups  in Chennai  to provide nutritious food at an affordable price for the poor""",Monkey_Paralysed,98,14,37,http://www.reddit.com/r/india/comments/1cj89q/jayalithaas_onerupee_idlis_are_a_hit_the_tamil/,FALSE,http://f.thumbs.redditmedia.com/RiBcyLHwusIzsnES.jpg,t5_2qh1q,FALSE,FALSE,t3_1cj89q
1365909880,88,en.wikipedia.org,1cb2zh,TIL that no Indian PM thus far has been born in independent India.,WavyLay,104,16,18,http://www.reddit.com/r/india/comments/1cb2zh/til_that_no_indian_pm_thus_far_has_been_born_in/,FALSE,http://b.thumbs.redditmedia.com/7_heNfFJR_SOanOU.jpg,t5_2qh1q,FALSE,FALSE,t3_1cb2zh
1365518751,84,imgur.com,1bzp68,Seems legit,aroondeep,98,14,47,http://www.reddit.com/r/india/comments/1bzp68/seems_legit/,FALSE,http://b.thumbs.redditmedia.com/85qgl5j_53MV7_Wm.jpg,t5_2qh1q,FALSE,FALSE,t3_1bzp68
1364702792,87,self.india,1bcbuf,Airtel Scamming on prepaid?,PleaseAdjust,100,13,82,http://www.reddit.com/r/india/comments/1bcbuf/airtel_scamming_on_prepaid/,FALSE,self,t5_2qh1q,1364711537,TRUE,t3_1bcbuf
1362995225,81,i.imgur.com,1a2on9,Today  everyone on /r/india...,MeManoos,104,23,39,http://www.reddit.com/r/india/comments/1a2on9/today_everyone_on_rindia/,FALSE,http://a.thumbs.redditmedia.com/8AgX2wCvGbiY14wT.jpg,t5_2qh1q,FALSE,FALSE,t3_1a2on9
1362925755,83,imgur.com,1a0vi8,Indian Air Force (174 pics),Chocolate_Horlicks,103,20,23,http://www.reddit.com/r/india/comments/1a0vi8/indian_air_force_174_pics/,FALSE,http://a.thumbs.redditmedia.com/Uess0cNLXuyyHHR6.jpg,t5_2qh1q,FALSE,FALSE,t3_1a0vi8
1361612109,86,imgur.com,192ocf,Glimpses from the Mahakumbh  India: The Largest Pilgrimage on Earth (x-post from /r/pics),chiaroscuro15,94,8,18,http://www.reddit.com/r/india/comments/192ocf/glimpses_from_the_mahakumbh_india_the_largest/,FALSE,http://b.thumbs.redditmedia.com/JYf2PdF3lb2h1IrU.jpg,t5_2qh1q,FALSE,FALSE,t3_192ocf
1360071320,88,punjabnewsline.com,17xj7r,Flying Sikh Milkha Singh took just one rupee from Rakeysh Omprakash Mehra to allow him to make film on his life,sarfaraaz,94,6,10,http://www.reddit.com/r/india/comments/17xj7r/flying_sikh_milkha_singh_took_just_one_rupee_from/,FALSE,http://c.thumbs.redditmedia.com/8pk_NHdniixdqUNP.jpg,t5_2qh1q,FALSE,FALSE,t3_17xj7r
1357424039,84,mirror.co.uk,16109e,Where DelhiGangrape victim's father personally reveals daughter's name  says it will give courage.,assholeness,110,26,65,http://www.reddit.com/r/india/comments/16109e/where_delhigangrape_victims_father_personally/,FALSE,http://e.thumbs.redditmedia.com/pCLsOt07PWjNW7pX.jpg,t5_2qh1q,FALSE,FALSE,t3_16109e
1354602889,83,tv.onlinemoviesportsandtv.com,1490xe,The best News Channel of the country. After years I opened this channel  I had nothing but tears in my eyes. No bullshit  no sensations  pure news in classified format. ,dreamist,102,19,43,http://www.reddit.com/r/india/comments/1490xe/the_best_news_channel_of_the_country_after_years/,FALSE,http://f.thumbs.redditmedia.com/l9Jjj0gReks_5Iu_.jpg,t5_2qh1q,FALSE,FALSE,t3_1490xe
1352948333,84,youtu.be,137w90,I figured some of you may like this video I made  few weeks ago. I put in some effort in this. I will welcome any feedback/comments. ,happymogambo,104,20,39,http://www.reddit.com/r/india/comments/137w90/i_figured_some_of_you_may_like_this_video_i_made/,FALSE,http://a.thumbs.redditmedia.com/hKg47VJPeh-TP8Lr.jpg,t5_2qh1q,FALSE,FALSE,t3_137w90
1352446754,82,i.imgur.com,12wkel,In mumbai,thuglaq,100,18,56,http://www.reddit.com/r/india/comments/12wkel/in_mumbai/,FALSE,http://e.thumbs.redditmedia.com/yMgYSwUpWSmWbdoX.jpg,t5_2qh1q,FALSE,FALSE,t3_12wkel
1346832367,84,washingtonpost.com,zdudc,India’s ‘silent’ prime minister becomes a tragic figure - The Washington Post,ani625,100,16,42,http://www.reddit.com/r/india/comments/zdudc/indias_silent_prime_minister_becomes_a_tragic/,FALSE,http://e.thumbs.redditmedia.com/FYarp0SBQq8t8IA4.jpg,t5_2qh1q,FALSE,FALSE,t3_zdudc
1343146691,86,imgur.com,x2uil,Show some love for these women extraordinaire!,saptarsi,106,20,38,http://www.reddit.com/r/india/comments/x2uil/show_some_love_for_these_women_extraordinaire/,FALSE,http://f.thumbs.redditmedia.com/WeFRanVeraw9wYoY.jpg,t5_2qh1q,FALSE,FALSE,t3_x2uil
1340265050,83,i.imgur.com,vdft4,Why I love India,chaitan94,107,24,56,http://www.reddit.com/r/india/comments/vdft4/why_i_love_india/,FALSE,http://b.thumbs.redditmedia.com/y0CcP8ZjEhVnZqLg.jpg,t5_2qh1q,FALSE,FALSE,t3_vdft4
1336405530,84,imgur.com,tbaf9,New qualification in the marriage market: Bubbly and.. non-what??,wanderingmind,101,17,39,http://www.reddit.com/r/india/comments/tbaf9/new_qualification_in_the_marriage_market_bubbly/,FALSE,http://b.thumbs.redditmedia.com/V97lU2L8iqGdrs1a.jpg,t5_2qh1q,FALSE,FALSE,t3_tbaf9
1335688847,86,imgur.com,sxz5t,Mist of the Western Ghats,saptarsi,95,9,25,http://www.reddit.com/r/india/comments/sxz5t/mist_of_the_western_ghats/,FALSE,http://e.thumbs.redditmedia.com/hh8FcCf36L6IGveX.jpg,t5_2qh1q,FALSE,FALSE,t3_sxz5t
1334809936,83,timesofindia.indiatimes.com,shccm,Agni-V  India's first ICBM test-fired successfully !!,Manoos,107,24,47,http://www.reddit.com/r/india/comments/shccm/agniv_indias_first_icbm_testfired_successfully/,FALSE,http://f.thumbs.redditmedia.com/iQTXoDHe2pj2k8PY.jpg,t5_2qh1q,FALSE,FALSE,t3_shccm
1333293515,85,self.india,rnzzc,"Alright Mods. You've had your fun. Seriously This shit 
isn't funny anymore.",brownboy15,144,59,108,http://www.reddit.com/r/india/comments/rnzzc/alright_mods_youve_had_your_fun_seriously_this/,FALSE,self,t5_2qh1q,TRUE,TRUE,t3_rnzzc
1332557166,83,youtube.com,raxo9,India Wins FIRST Ever International Ice Hockey Game,douchebag_duryodhana,95,12,14,http://www.reddit.com/r/india/comments/raxo9/india_wins_first_ever_international_ice_hockey/,FALSE,http://f.thumbs.redditmedia.com/j9Av6GtP6ulp_vH_.jpg,t5_2qh1q,FALSE,FALSE,t3_raxo9
1331061629,86,i.imgur.com,qkitg,This was the best thing money could buy in summers. Do you still get these ?,Manoos,115,29,39,http://www.reddit.com/r/india/comments/qkitg/this_was_the_best_thing_money_could_buy_in/,FALSE,http://c.thumbs.redditmedia.com/pSgIebeTwH_3MPJh.jpg,t5_2qh1q,FALSE,FALSE,t3_qkitg
1319042183,80,imgur.com,lhmn6,Differences,vjfalk,104,24,23,http://www.reddit.com/r/india/comments/lhmn6/differences/,FALSE,http://thumbs.reddit.com/t3_lhmn6.png,t5_2qh1q,FALSE,FALSE,t3_lhmn6
1314191850,81,imgur.com,jsttm,The day a girl hit on me [True Story](only in India),utsavman,99,18,50,http://www.reddit.com/r/india/comments/jsttm/the_day_a_girl_hit_on_me_true_storyonly_in_india/,FALSE,http://thumbs.reddit.com/t3_jsttm.png,t5_2qh1q,FALSE,FALSE,t3_jsttm
1310299176,84,i.imgur.com,iljz6,Devdas Rage,paperman1,103,19,41,http://www.reddit.com/r/india/comments/iljz6/devdas_rage/,FALSE,http://thumbs.reddit.com/t3_iljz6.png,t5_2qh1q,FALSE,FALSE,t3_iljz6
1376544411,82,i.imgur.com,1kehz0,This independence day MMS has lots of reasons to be proud!,randomthinker035,107,25,14,http://www.reddit.com/r/india/comments/1kehz0/this_independence_day_mms_has_lots_of_reasons_to/,FALSE,http://e.thumbs.redditmedia.com/qVBiBvhgv3z9yasj.jpg,t5_2qh1q,FALSE,FALSE,t3_1kehz0
1374483149,87,hindustantimes.com,1isvpv,Italian Odissi dancer Citaristi beaten by Puri priests,nomadicphilander,115,28,16,http://www.reddit.com/r/india/comments/1isvpv/italian_odissi_dancer_citaristi_beaten_by_puri/,FALSE,http://d.thumbs.redditmedia.com/503MSvf4AQPcl9ji.jpg,t5_2qh1q,FALSE,FALSE,t3_1isvpv
1374290843,82,thehindu.com,1ioche,Behind China’s Hindu temples  a forgotten history,reddit_indian,106,24,85,http://www.reddit.com/r/india/comments/1ioche/behind_chinas_hindu_temples_a_forgotten_history/,FALSE,http://e.thumbs.redditmedia.com/ZoW7E2BXNGIwUaSF.jpg,t5_2qh1q,FALSE,FALSE,t3_1ioche
1373540684,85,i.imgur.com,1i2nei,How I see the DesiKid1-Envia Drama unfold..,ninjasoar,120,35,71,http://www.reddit.com/r/india/comments/1i2nei/how_i_see_the_desikid1envia_drama_unfold/,FALSE,http://a.thumbs.redditmedia.com/BVfAdFWz0CmBnp16.jpg,t5_2qh1q,FALSE,FALSE,t3_1i2nei
1373515246,82,manikarthik.com,1i24f2,What Salman Khan don’t want you to blog about,imaketrollfaces,108,26,20,http://www.reddit.com/r/india/comments/1i24f2/what_salman_khan_dont_want_you_to_blog_about/,FALSE,http://d.thumbs.redditmedia.com/67ZOp-j56GOgcbg-.jpg,t5_2qh1q,FALSE,FALSE,t3_1i24f2
1369656973,83,moneylife.in,1f4ts6,Kerala Police arrest Amway India chief  two directors,verifix,95,12,22,http://www.reddit.com/r/india/comments/1f4ts6/kerala_police_arrest_amway_india_chief_two/,FALSE,http://c.thumbs.redditmedia.com/XRq5hgGYgLOMXUVD.jpg,t5_2qh1q,FALSE,FALSE,t3_1f4ts6
1367408503,80,newstatesman.com,1dh4x4,Russian  Israeli Tourists Accused of ‘Occupying' Goan Villages. Israelis and Russians who have stayed in India for a long time are creating their own enclaves in Goan villages. Meanwhile there are various beach shacks which not to serve Indians.,douchebag_duryodhana,90,10,31,http://www.reddit.com/r/india/comments/1dh4x4/russian_israeli_tourists_accused_of_occupying/,FALSE,http://b.thumbs.redditmedia.com/GkF5jiWoeJR_E-S7.jpg,t5_2qh1q,FALSE,FALSE,t3_1dh4x4
1366868937,80,i.imgur.com,1d2f7t,Lungi  Sardar  Patel  Mullah  everbody. United we stand.,lolguard,115,35,65,http://www.reddit.com/r/india/comments/1d2f7t/lungi_sardar_patel_mullah_everbody_united_we_stand/,FALSE,http://c.thumbs.redditmedia.com/CrQIhFvPF5S3aQqV.jpg,t5_2qh1q,FALSE,FALSE,t3_1d2f7t
1365684233,83,blogs.wsj.com,1c4q3h,The first Indian to circumnavigate the world alone speaks of his trip and his sense of loss at returning onshore,rahulthewall,95,12,23,http://www.reddit.com/r/india/comments/1c4q3h/the_first_indian_to_circumnavigate_the_world/,FALSE,http://d.thumbs.redditmedia.com/kRF9O-d8bzllRSu9.jpg,t5_2qh1q,FALSE,FALSE,t3_1c4q3h
1364696661,84,blogs.timesofindia.indiatimes.com,1bc5h5,A Doctor gets arrested  after he asks police sub-inspector accompanying Tamil Nadu chief minister J Jayalalithaa  who was visiting a patient in Apollo Specialty Hospitals  to remove his shoes before entering the intensive care unit.,naveen_reloaded,103,19,32,http://www.reddit.com/r/india/comments/1bc5h5/a_doctor_gets_arrested_after_he_asks_police/,FALSE,http://d.thumbs.redditmedia.com/LUQaWlqxqhHIcLXW.jpg,t5_2qh1q,FALSE,FALSE,t3_1bc5h5
1364229357,81,timesofindia.indiatimes.com,1azbif,Maharashtra: Assaulted cop suspended  MLAs walk out of jail on bail,undeadlock,91,10,9,http://www.reddit.com/r/india/comments/1azbif/maharashtra_assaulted_cop_suspended_mlas_walk_out/,FALSE,http://c.thumbs.redditmedia.com/h2WYUNuhlRj_OFGt.jpg,t5_2qh1q,FALSE,FALSE,t3_1azbif
1364132123,82,mumbaimirror.com,1awupb,Blacklist - Mumbai Mirror (Racism against Africans in Mumbai),ikosheen2,93,11,16,http://www.reddit.com/r/india/comments/1awupb/blacklist_mumbai_mirror_racism_against_africans/,FALSE,http://e.thumbs.redditmedia.com/E3V_1AjzkuZofauF.jpg,t5_2qh1q,FALSE,FALSE,t3_1awupb
1362032446,82,self.india,19dssb,Budget thread,parlor_tricks,93,11,124,http://www.reddit.com/r/india/comments/19dssb/budget_thread/,FALSE,self,t5_2qh1q,1362037822,TRUE,t3_19dssb
1361255974,85,imgur.com,18t06o,Friend from Cognizant shared this.,czle,100,15,78,http://www.reddit.com/r/india/comments/18t06o/friend_from_cognizant_shared_this/,FALSE,http://d.thumbs.redditmedia.com/kYrRN54PoM_MYaQK.jpg,t5_2qh1q,FALSE,FALSE,t3_18t06o
1360332990,83,newslaundry.com,184qoo,Leave Or Die: In the 1998 Wandhama massacre  where according to the only survivor  the Muslims of the small village turned up the sound of the mosque loudspeaker to muffle the sounds of bullets that killed 23 Pandit fellow villagers. ,douchebag_duryodhana,110,27,70,http://www.reddit.com/r/india/comments/184qoo/leave_or_die_in_the_1998_wandhama_massacre_where/,FALSE,http://f.thumbs.redditmedia.com/-sJvQzegzhj2tECA.jpg,t5_2qh1q,FALSE,FALSE,t3_184qoo
1357089259,86,guardian.co.uk,15srtv,Disgracefully biased reporting in West on Indian rape ,newreligionEU,106,20,42,http://www.reddit.com/r/india/comments/15srtv/disgracefully_biased_reporting_in_west_on_indian/,FALSE,http://c.thumbs.redditmedia.com/slOPF4Ci3xlNOrBP.jpg,t5_2qh1q,FALSE,FALSE,t3_15srtv
1356843736,85,firstpost.com,15nrsy,This man (Salman Khan) is accused of subverting the Justice System  culpable homicide but see the 'protesting and ashamed india' line up outside his house to celebrate him. ,satan_dreaming,112,27,31,http://www.reddit.com/r/india/comments/15nrsy/this_man_salman_khan_is_accused_of_subverting_the/,FALSE,http://c.thumbs.redditmedia.com/piZjiXrhod2evVjz.jpg,t5_2qh1q,FALSE,FALSE,t3_15nrsy
1353812834,83,guardian.co.uk,13qrlt,Sanal Edamaruku faces jail for revealing 'tears' trickling down a Mumbai church statue came from clogged drainage pipes,theonlybond,104,21,41,http://www.reddit.com/r/india/comments/13qrlt/sanal_edamaruku_faces_jail_for_revealing_tears/,FALSE,http://b.thumbs.redditmedia.com/P-TUOs6C6ccIKL0m.jpg,t5_2qh1q,FALSE,FALSE,t3_13qrlt
1352835385,82,youtube.com,134yhi,Pakistan Officially Accepts its Involvement in Mumbai Massacare,lolzoid,99,17,17,http://www.reddit.com/r/india/comments/134yhi/pakistan_officially_accepts_its_involvement_in/,FALSE,http://b.thumbs.redditmedia.com/WX3H8La9G7USu2OU.jpg,t5_2qh1q,FALSE,FALSE,t3_134yhi
1349797034,84,i.imgur.com,117721,Weapons upgrade for Ganesha ( via Holy Cow entertainment ),thuglaq,102,18,54,http://www.reddit.com/r/india/comments/117721/weapons_upgrade_for_ganesha_via_holy_cow/,FALSE,http://d.thumbs.redditmedia.com/AL7Gv7KHkwYVIpYK.jpg,t5_2qh1q,FALSE,FALSE,t3_117721
1343147871,79,i.dailymail.co.uk,x2vp2,Indian Navy Marine Commandos on board INS Sahyadri wear a new look,livenletlive,94,15,59,http://www.reddit.com/r/india/comments/x2vp2/indian_navy_marine_commandos_on_board_ins/,FALSE,http://a.thumbs.redditmedia.com/uEbDqf3VG5weI8tH.jpg,t5_2qh1q,FALSE,FALSE,t3_x2vp2
1333697223,81,india-shinning.blogspot.com,rw01d,"TIL the brilliance and integrity of Mr Narayanaswamy (IAS Officer) who is on the verge of leaving the service owing to the corrupt politicians who cant force him to look the other way.  
He needs to be known and acknowledged for his service to India.",brutus_aus,103,22,13,http://www.reddit.com/r/india/comments/rw01d/til_the_brilliance_and_integrity_of_mr/,FALSE,http://f.thumbs.redditmedia.com/ZUeS4SecSUoKA0Aw.jpg,t5_2qh1q,FALSE,FALSE,t3_rw01d
1327926648,85,i.imgur.com,p2xi2,When I told them I am going to an Art/Design college.,worah,105,20,26,http://www.reddit.com/r/india/comments/p2xi2/when_i_told_them_i_am_going_to_an_artdesign/,FALSE,http://c.thumbs.redditmedia.com/hBbBulzcImGtkLeb.jpg,t5_2qh1q,FALSE,FALSE,t3_p2xi2
1312726170,81,self.india,jbjl0,Post-SlutWalk  another normal week in NCR,cleank1tty,96,15,60,http://www.reddit.com/r/india/comments/jbjl0/postslutwalk_another_normal_week_in_ncr/,FALSE,self,t5_2qh1q,FALSE,TRUE,t3_jbjl0
1309026351,84,i.imgur.com,i91fz,Meetup waalon!,kabuliwallah,94,10,22,http://www.reddit.com/r/india/comments/i91fz/meetup_waalon/,FALSE,http://thumbs.reddit.com/t3_i91fz.png,t5_2qh1q,FALSE,FALSE,t3_i91fz
1375085423,81,youtube.com,1j9kfv,A mob of 500 attacked an Animal Activist  Anthony Joshine  and her friends  with helmets  lathis  stones  and pieces of glass; when she tried to protect cattle from illegal slaughter. Despite her pleas for more police force  the officer in charge told her  “We can manage.” [Video: skip first 25 sec],chamaar,105,24,45,http://www.reddit.com/r/india/comments/1j9kfv/a_mob_of_500_attacked_an_animal_activist_anthony/,FALSE,http://d.thumbs.redditmedia.com/O-uN1lTQ-94vZ9_Q.jpg,t5_2qh1q,FALSE,FALSE,t3_1j9kfv
1373583680,81,uk.reuters.com,1i45wt,Dhoni wins Tri Nation series for India in thriller! Hits 15 off 4 balls in the final over!,kash_if,117,36,44,http://www.reddit.com/r/india/comments/1i45wt/dhoni_wins_tri_nation_series_for_india_in/,FALSE,http://c.thumbs.redditmedia.com/yLZRDD5Icckbroth.jpg,t5_2qh1q,FALSE,FALSE,t3_1i45wt
1372993883,83,dnaindia.com,1ho64j,Floods in Assam sweep away 300 villages  destroy homes and crops,thuglaq,94,11,12,http://www.reddit.com/r/india/comments/1ho64j/floods_in_assam_sweep_away_300_villages_destroy/,FALSE,http://b.thumbs.redditmedia.com/qkg1nqccQspTSrQm.jpg,t5_2qh1q,FALSE,FALSE,t3_1ho64j
1371833452,81,imgur.com,1gsxop,Peace Mobile - The Solution for Humanity,arjuna007,99,18,49,http://www.reddit.com/r/india/comments/1gsxop/peace_mobile_the_solution_for_humanity/,FALSE,http://c.thumbs.redditmedia.com/pZ6cQoiJwXyLisH8.jpg,t5_2qh1q,FALSE,FALSE,t3_1gsxop
1364585619,81,self.india,1b9d2d,"(x-post from worldnews) See the difference  A girl is raped in Scotland  and the top most comment is ""Why is this on worldnews?""",neoindian,109,28,62,http://www.reddit.com/r/india/comments/1b9d2d/xpost_from_worldnews_see_the_difference_a_girl_is/,FALSE,self,t5_2qh1q,FALSE,TRUE,t3_1b9d2d
1364278585,81,youtube.com,1b10rm,[x-post justiceporn] Yes Men - Impersonates Dow Chemical official  fools BBC to believe Dow Chemical will take full responsibility for Bhopal disaster - Dow's shares go down 2 billion as a result.,vnkatesh,93,12,25,http://www.reddit.com/r/india/comments/1b10rm/xpost_justiceporn_yes_men_impersonates_dow/,FALSE,http://f.thumbs.redditmedia.com/iiZWhLvr77pydJfY.jpg,t5_2qh1q,FALSE,FALSE,t3_1b10rm
1364015975,82,quickmeme.com,1augdt,With the recent influx of those people,holywtfman,123,41,86,http://www.reddit.com/r/india/comments/1augdt/with_the_recent_influx_of_those_people/,FALSE,http://e.thumbs.redditmedia.com/G1YqtstvChrjfSYp.jpg,t5_2qh1q,FALSE,FALSE,t3_1augdt
1363691640,86,quickmeme.com,1al4o7,Success Kid...,popeculture,125,39,11,http://www.reddit.com/r/india/comments/1al4o7/success_kid/,FALSE,http://d.thumbs.redditmedia.com/HaGmz_gFs23L6HjQ.jpg,t5_2qh1q,FALSE,FALSE,t3_1al4o7
1362631811,81,self.india,19tsur,Just a reminder: Chhavi Rajawat  first woman Sarpanch with an MBA degree is doing an IAmA at 7:00 pm IST,ScheduledTroll,102,21,41,http://www.reddit.com/r/india/comments/19tsur/just_a_reminder_chhavi_rajawat_first_woman/,FALSE,self,t5_2qh1q,1362665744,TRUE,t3_19tsur
1362594989,85,now.msn.com,19sfem,Indian keeping Indian slave in New York,vinieux,100,15,55,http://www.reddit.com/r/india/comments/19sfem/indian_keeping_indian_slave_in_new_york/,FALSE,http://c.thumbs.redditmedia.com/nuq280kUS39ArzSn.jpg,t5_2qh1q,FALSE,FALSE,t3_19sfem
